{
  "name": "tag-group",
  "template": "tag-group/tag-group.django.html",
  "version": 2,
  "props": {
    "tagProps": {
      "type": "array",
      "description": "Array of tags rendered by the group.",
      "items": {
        "type": "object",
        "description": "Tag item.",
        "component": "tag"
      }
    },
    "children": {
      "type": "slot",
      "description": "Inner HTML or text"
    },
    "className": {
      "type": "string",
      "description": "Additional classes"
    }
  }
}
