{
  "name": "tooltip",
  "template": "tooltip/tooltip.django.html",
  "version": 2,
  "props": {
    "label": {
      "type": "slot",
      "default": "Tooltip text",
      "description": "Content displayed inside the tooltip body. Accepts text or composed content, such as React nodes or a Django template fragment."
    },
    "position": {
      "type": "select",
      "options": [
        "top",
        "bottom",
        "left",
        "right"
      ],
      "default": "top",
      "description": "The direction the tooltip appears relative to its trigger."
    },
    "children": {
      "type": "slot",
      "default": null,
      "description": "The trigger element that activates the tooltip on hover or focus."
    },
    "className": {
      "type": "string",
      "default": "",
      "description": "Additional CSS classes to apply to the tooltip wrapper."
    },
    "bodyClassName": {
      "type": "string",
      "default": "",
      "description": "Additional CSS classes to apply to the tooltip body."
    }
  }
}
