{
  "name": "file-input",
  "template": "file-input/file-input.django.html",
  "version": 2,
  "default": {
    "id": "file-input-single",
    "name": "file-input-single",
    "label": "Input accepts a single file"
  },
  "props": {
    "id": {
      "type": "string",
      "default": "file-input-single",
      "description": "id for the input. Label and hint ids are derived from this."
    },
    "name": {
      "type": "string",
      "description": "name attribute for the input. Defaults to id."
    },
    "label": {
      "type": "slot",
      "description": "Label text for the field."
    },
    "hint": {
      "type": "slot",
      "description": "Hint text displayed below the label."
    },
    "fileListHint": {
      "type": "slot",
      "default": "Selected files",
      "description": "Heading/hint text shown above the managed file list, passed to FileList's hint prop. React only."
    },
    "error": {
      "type": "slot",
      "description": "Error message. Renders aria-describedby and error styling."
    },
    "disabled": {
      "type": "boolean",
      "default": false,
      "description": "Disables the input."
    },
    "required": {
      "type": "boolean",
      "default": false,
      "description": "Marks the field as required."
    },
    "accept": {
      "type": "string",
      "description": "Comma-separated list of accepted file types/extensions, e.g. \".pdf,.txt\"."
    },
    "multiple": {
      "type": "boolean",
      "default": false,
      "description": "Allows selecting more than one file."
    },
    "manageIndividualFiles": {
      "type": "boolean",
      "default": false,
      "description": "When multiple is true, selects files one at a time into a managed list where each file has its own Delete action (VA.gov file-input-multiple pattern). React only."
    },
    "invalidFileTypeMessage": {
      "type": "string",
      "description": "Custom error message shown when a selected file doesn't match `accept`. Sets data-errormessage."
    },
    "formGroup": {
      "type": "boolean",
      "default": true,
      "description": "Whether to wrap the label/hint/error/control in a `.usa-form-group`. Set to `false` when composing inside another form group."
    },
    "className": {
      "type": "string",
      "default": "",
      "description": "Additional classes for the usa-file-input."
    },
    "defaultFiles": {
      "type": "array",
      "description": "When manageIndividualFiles is true, seeds the managed file list with files that already exist on the server (no browser File object). Each entry is { name, size?, url? } — omit size to show no size, provide url to render the name as a download link. React only."
    }
  }
}
