{
  "name": "card",
  "template": "card/card.django.html",
  "version": 4,
  "props": {
    "id": {
      "type": "string",
      "description": "Card element ID."
    },
    "title": {
      "type": "string",
      "description": "The title text displayed in the card header"
    },
    "description": {
      "type": "string",
      "description": "The description text displayed in the card body"
    },
    "tagProps": {
      "type": "array",
      "description": "Props for each tag component.",
      "items": {
        "type": "object",
        "component": "tag",
        "description": "Props passed to the tag component."
      }
    },
    "buttonProps": {
      "type": "array",
      "description": "Props for each button component.",
      "items": {
        "type": "object",
        "component": "button",
        "description": "Props passed to the button component.",
        "properties": {
          "itemClassName": {
            "type": "string",
            "description": "Additional classes for the button group list item."
          }
        }
      }
    },
    "imageProps": {
      "type": "array",
      "description": "Props for each image component.",
      "items": {
        "type": "object",
        "component": "image",
        "description": "Props passed to the image component."
      }
    },
    "headerFirst": {
      "type": "boolean",
      "default": false,
      "description": "Whether to display the header before the media section"
    },
    "flag": {
      "type": "boolean",
      "default": false,
      "description": "Whether to use the flag layout where media and content are side-by-side"
    },
    "mediaRight": {
      "type": "boolean",
      "default": false,
      "description": "Whether to place media on the right side in flag layout"
    },
    "mediaInset": {
      "type": "boolean",
      "default": false,
      "description": "Whether to inset the media within the card container"
    },
    "mediaExdent": {
      "type": "boolean",
      "default": false,
      "description": "Whether to extend the media outside the card container boundaries"
    },
    "showCarouselDots": {
      "type": "boolean",
      "default": true,
      "description": "Whether to show navigation dots when multiple images are provided"
    },
    "children": {
      "type": "slot",
      "description": "Inner HTML or text content (alternative to structured props)"
    },
    "className": {
      "type": "string",
      "description": "Additional CSS classes"
    },
    "containerClassName": {
      "type": "string",
      "description": "Additional CSS classes for the card container"
    },
    "tag": {
      "type": "string",
      "description": "HTML tag to use for the card element (div or li)"
    }
  }
}
