{
  "name": "code",
  "template": "code/code.django.html",
  "version": 1,
  "required": [
    "lines"
  ],
  "props": {
    "staticBaseUrl": {
      "type": "string",
      "description": "Optional asset base for this component. A non-empty value overrides window.usxBaseUrl in React or STATIC_URL in Django; otherwise the global base or / is used. Asset filenames remain separate."
    },
    "lines": {
      "type": "array",
      "description": "Array of line objects. Each supports: code (string), prefix (string, omit for no data-prefix attribute), className (string).",
      "items": {
        "type": "object",
        "description": "Terminal line.",
        "properties": {
          "code": {
            "type": "string",
            "description": "Literal line content, including HTML or JSX source. Interpreted as trusted HTML only when allowHtml is true."
          },
          "prefix": {
            "type": "string",
            "description": "data-prefix attribute; omit for no prefix."
          },
          "className": {
            "type": "string",
            "description": "Additional classes."
          }
        }
      }
    },
    "allowHtml": {
      "type": "boolean",
      "default": false,
      "description": "Render line content as HTML instead of literal text. Only enable for trusted HTML; content is not sanitized. Leave false when documenting HTML or React markup."
    },
    "copyText": {
      "type": "string",
      "description": "Text to copy when the copy button is clicked. If provided, shows the copy button."
    },
    "className": {
      "type": "string",
      "description": "Additional CSS classes to apply to the wrapper div."
    },
    "contentClassName": {
      "type": "string",
      "description": "Additional CSS classes to apply to the content wrapper div inside the component."
    }
  }
}
