{
  "name": "button",
  "template": "button/button.django.html",
  "version": 2,
  "props": {
    "label": {
      "type": "string",
      "description": "The text to be displayed on the button, providing a clear and concise indication of the button's purpose or action."
    },
    "variant": {
      "type": "select",
      "options": [
        "primary",
        "secondary",
        "accent-cool",
        "accent-warm",
        "base",
        "outline",
        "unstyled"
      ],
      "description": "The visual style of the button, which can be used to indicate the importance or type of action the button represents."
    },
    "type": {
      "type": "select",
      "options": [
        "button",
        "submit",
        "reset"
      ],
      "description": "The HTML button type attribute, which specifies the behavior of the button when it is clicked."
    },
    "disabled": {
      "type": "boolean",
      "description": "A boolean that determines whether the button is disabled, preventing user interaction and indicating that the button is not currently available for action.",
      "default": false
    },
    "onClick": {
      "type": "function",
      "description": "A function that is called when the button is clicked, allowing for custom behavior to be executed in response to the user's interaction with the button."
    },
    "href": {
      "type": "string",
      "description": "The URL that the button should navigate to when clicked, if the button is used as a link."
    },
    "isExternal": {
      "type": "boolean",
      "description": "A boolean that determines whether the link should open in a new tab or window, indicating that the destination is external to the current site.",
      "default": false
    },
    "big": {
      "type": "boolean",
      "description": "A boolean that determines whether the button should be displayed in a larger size, making it more prominent and easier to interact with.",
      "default": false
    },
    "inverse": {
      "type": "boolean",
      "description": "A boolean that determines whether the button should be displayed with an inverse color scheme, which can be used to create contrast against a darker background.",
      "default": false
    },
    "ghost": {
      "type": "boolean",
      "description": "A boolean that determines whether the button should be displayed in a ghost style, which typically features a transparent background and a border, giving it a more subtle appearance.",
      "default": false
    },
    "loading": {
      "type": "boolean",
      "description": "When true, displays a loading spinner before any left-positioned icons, indicating the button's action is in progress.",
      "default": false
    },
    "iconProps": {
      "type": "array",
      "description": "Icons to render alongside the button label.",
      "items": {
        "type": "object",
        "description": "An icon instance for the button. Mirrors the icon component's props.",
        "component": "icon",
        "properties": {
          "position": {
            "type": "select",
            "options": ["left", "right"],
            "default": "left",
            "description": "Which side of the button label to render this icon on."
          }
        }
      }
    },
    "className": {
      "type": "string",
      "description": "Additional CSS classes to apply to the button component."
    },
    "style": {
      "type": "object",
      "description": "Inline styles as a React CSSProperties object.",
      "renderers": {
        "react": { "type": "object" },
        "django": {
          "supported": false,
          "description": "The Django template does not render this prop."
        }
      }
    },
    "children": {
      "type": "slot",
      "description": "Button content as text or composed content (React nodes or a Django template fragment); takes precedence over label when truthy."
    },
    "extraAttributes": {
      "type": "object",
      "description": "An object containing any additional HTML attributes to be spread onto the button element, providing flexibility for custom use cases or integrations."
    }
  }
}
