{
  "name": "site-alert",
  "template": "site-alert/site-alert.django.html",
  "version": 2,
  "props": {
    "className": {
      "type": "string",
      "description": "Additional classes"
    },
    "variant": {
      "type": "select",
      "options": [
        "info",
        "emergency",
        "maintenance",
        "maintenance-warning"
      ],
      "description": "Site alert variant"
    },
    "slim": {
      "type": "boolean",
      "description": "Slim alert variant"
    },
    "noIcon": {
      "type": "boolean",
      "description": "Hide the alert icon"
    },
    "onDismiss": {
      "type": "function",
      "description": "Optional callback fired when the dismiss button is clicked. When provided, a dismiss button is rendered inside the alert body."
    },
    "role": {
      "type": "select",
      "options": [
        "",
        "alert",
        "status"
      ],
      "description": "Optional ARIA role for the site alert section"
    },
    "alertHeading": {
      "type": "string",
      "description": "Alert heading text",
      "default": "Short alert message"
    },
    "alertText": {
      "type": "string",
      "description": "Alert text content",
      "default": "Additional context and followup information including a link."
    },
    "alertContent": {
      "type": "slot",
      "description": "Alert rich content (React node / HTML string)"
    },
    "ariaLabel": {
      "type": "string",
      "description": "Aria label for section"
    },
    "ariaLabelledby": {
      "type": "string",
      "description": "Aria-labelledby target for section (preferred over ariaLabel)"
    }
  }
}
