{
  "name": "fieldset",
  "template": "fieldset/fieldset.django.html",
  "version": 2,
  "props": {
    "legend": {
      "type": "slot",
      "description": "Text for the fieldset legend"
    },
    "largeLegend": {
      "type": "boolean",
      "description": "Whether to use the larger legend style (adds class `usa-legend--large`)"
    },
    "required": {
      "type": "boolean",
      "description": "Whether to indicate the field is required (adds an asterisk to the legend)"
    },
    "disabled": {
      "type": "boolean",
      "description": "Whether to disable all form controls within the fieldset"
    },
    "hint": {
      "type": "slot",
      "description": "Group-level hint text, rendered after the legend"
    },
    "error": {
      "type": "slot",
      "description": "Group-level error message, rendered after the hint"
    },
    "hintId": {
      "type": "string",
      "description": "Element id for the hint span"
    },
    "errorId": {
      "type": "string",
      "description": "Element id for the error message span"
    },
    "children": {
      "type": "slot",
      "description": "Inner HTML or text"
    },
    "className": {
      "type": "string",
      "description": "Additional classes"
    }
  }
}
