{
  "name": "required",
  "template": "required/required.django.html",
  "version": 3,
  "props": {
    "title": {
      "type": "string",
      "default": "Required",
      "description": "Title attribute for the required indicator (default: 'Required')"
    },
    "children": {
      "type": "slot",
      "description": "Inner HTML or text"
    },
    "className": {
      "type": "string",
      "description": "Additional classes"
    }
  }
}
